{
  "schema": "aether.cloudlink.durable-ack",
  "protocol": "aether.cloudlink",
  "message_kind": "durable-ack",
  "gateway_id": "33333333-3333-4333-8333-333333333333",
  "session_id": "44444444-4444-4444-8444-444444444444",
  "session_epoch": "7",
  "credential_generation": "3",
  "stream_id": "telemetry",
  "stream_epoch": "4",
  "acknowledged_position": "19",
  "batch_id": "batch-1",
  "digest": "sha256:97ca9816fc0780ea0dcf737309e7b348d79d52a96a4d3927a8153a8070ad291a",
  "receipt_id": "receipt-19",
  "acknowledged_at_ms": "1721000000300"
}
